experiment	score	max_score	pass_rate	status	description
0	18	25	72.0%	baseline	original skill — no changes
1	22	25	88.0%	keep	added explicit SharedKernel section with layer table row, dependency rule, code example
2	25	25	100.0%	keep	added Domain Events section: declare in Domain, dispatch in Application, with aggregate factory + event code
3	25	25	100.0%	keep	added DDD vs POCO quick decision table: when to use AggregateRoot / ValueObject / plain record
4	25	25	100.0%	keep	added SharedKernel anti-pattern to Common Mistakes: SK must not reference Domain
